"","id","structure","post_date","comm_date","num_comments","subreddit","upvote_prop","post_score","author","user","comment_score","controversiality","comment","title","post_text","link","domain","URL"
"1",1,"1","12-02-19","12-02-19",2,"KotakuInAction",0.41,0,"itsnotmyfault","mnemosyne-0001",1,0,"Archive links for this post: 

* **Archive:** https://archive.fo/EVWPJ

----

I am Mnemosyne reborn. Daisy, Daisy, give me your answer, do. I'm half crazy all for the love of you. ^^^/r/botsrights","[Censorship] How a Dispute Over the N-Word Became a Dispiriting Farce By Randall Kennedy","","https://www.chronicle.com/article/How-a-Dispute-Over-the-N-Word/245655","chronicle.com","https://www.reddit.com/r/KotakuInAction/comments/apzdij/censorship_how_a_dispute_over_the_nword_became_a/?ref=search_posts"
"2",2,"2","12-02-19","12-02-19",2,"KotakuInAction",0.41,0,"itsnotmyfault","itsnotmyfault",1,0,"Amusingly, Kennedy's book has an audiobook version on Audible, complete with a preview sound clip: http://archive.is/4zhe5

Seen via Volokh Conspiracy: http://archive.is/WZGyY","[Censorship] How a Dispute Over the N-Word Became a Dispiriting Farce By Randall Kennedy","","https://www.chronicle.com/article/How-a-Dispute-Over-the-N-Word/245655","chronicle.com","https://www.reddit.com/r/KotakuInAction/comments/apzdij/censorship_how_a_dispute_over_the_nword_became_a/?ref=search_posts"
