"","id2","user","time","entry","id_par2","comment_score","controversiality","comment"
"507",89,"KasumiKagura",9,9,24,2,0,"The reason Twitter is so fucked right now is because of journalists. Right now the only thing keeping twitter alive is trolls and outrage and right now outrage is whats driving people to the platform.

However that is slowly dwindling. The more Covington type blunders happen, the more libel lawsuits will happen the more careful journalists will be in stoking outrage. When these trust fund kiddies find out there is consequences to their lies and slander, the more they find their pockets empty and needing to scrape by with just ramen noodles, the more they lose their jobs because of their incompetence and failed gender studies degrees, the less twitter will be sustained by them, and the less of a shit twitter will give about them. "
"508",25,"Muskaos",9,1,2,4,0,"&gt;What do you guys think can be done about this? Is there any hope for the Twitter platform going forward, do we think that this bias will ever be addressed and/or removed, or is the market truly going to look towards alternative platforms like Gab and Minds for social media moving forward?

Twitter needs to lose it's Chapter 230 exemption to the Communication Decency Act. Only government can do that.

Once that happens, the pain of loosing tens of millions of dollars to lawsuits will bring them in line.

Either that, or they go broke, like they deserve to."
"509",64,"kriegson",9,4,2,3,0,"&gt;Cultural Colonelism, essentially?  They've become what they hate the most.  

An excellent point and what a surprise...totalitarians demand you act, speak and think as they desire."
"510",69,"mrmensplights",9,5,2,3,0,"The left doesn't believe they are biased because they don't believe in different points of view on politics (or their acceptable range is very narrow). They think their point of view is the moral standard; a matter of good and evil.

So from Twitters perspective they are both unbiased and also just banning bad people.

Conservatives know better because they stand behind free speech. Can't really do that and also believe someone with different ideas is evil.  Wrong sure, but bot necessarily evil.

Conservatives also have a richer tradition of intellectual diversity anyway. It's more a confederation of groups than the monolith the left is. A monolith that lets their extremists take over the whole show.

"
"511",26,"Lhasadog",9,1,1,22,0,"Wow! Im thinking Jacks Lawyers want to shoot him right now. Remember he was just sued, yesterday, by Feminist Journalist Meagan Murphy for banning her for saying Men are not Women. Jack just said her suit has merit.well done you brave progressive pinhead. I think Jack May actually come off as less appealing than Denton when it hits a jury. "
"512",27,"paranoidandroid1984",9,1,26,3,0,"His personal lawyer is probably incredibly happy with Jack. Twitter general council, on the other hand, may consider homicide. "
"513",28,"luckierbridgeandrail",9,1,27,6,0,"&gt; His personal lawyer is probably incredibly happy with Jack. 

Billable hours are billable hours.
"
"514",34,"npc435646",9,1,1,11,0,"STOP calling it progressive, it's not."
"515",35,"IronWolve",9,1,1,37,0,"Misgendering is bannable, calls for violence against a kid wearing a MAGA hat isn't.   

btw, I think misgendering can be rude in some circumstances, treat everyone with some respect, even if you don't agree with them.  Golden rule should apply to everyone. 
"
"516",36,"throwaway2348907987",9,1,35,44,0,"Respect goes both ways. If you believe someone claiming to be a woman is a man and that person tries to browbeat you into changing your views, often violently, and at the cost of your professional life that's not very respectful of your beliefs either.

IMO the transgenders are the ones being very disrespectful with their
&gt;I'll have your job, shithead

behavior. Trying to personally and professional destroy someone you don't know just because they have different beliefs is very tyrannical and dehumanizing."
"517",90,"IronWolve",9,9,36,23,0,"I work in tech, lots of transgenders in tech, male to female.  Never had a problem using their preferred pronoun, but we never talked about politics.  (thank goodness)

I actually hate that Transgender is being pushed on gay men and kids.  My kids and friends kids all said there is a spike in transgender in our kids junoir high schools in Seattle.   Its stupid that its becoming a trend, when its a real medical issue for people and being political.  Medical issues shouldnt be treated as a FAD, imho. "
"518",91,"throwaway2348907987",9,9,90,22,0,"There are a ton of other people who would prefer to say the emperor has no clothes but the price of a public freakout is not worth it and no one will defend them anyway. They feel like they're being forced to participate in a lie."
"519",92,"PrettyDecentSort",9,9,90,9,0,"&gt; I work in tech, lots of transgenders in tech, male to female

This is not true of tech worldwide nor even nationwide. It may be true of the I-5 corridor, but silicon valley is not synonymous with ""tech""."
"520",93,"Muskaos",9,9,36,11,0,"Anyone who knows how the left works should have expected this modern day inquisition. The radical left never does things for tolerance, they do things to bend amenable authority to their will. What they really want is to use government agents to enjoin abject grovelling by their hated enemies at gunpoint. For radical gays, this means Christianity. For Trans, this means the rest of society that is normal."
"521",94,"BadEnough",9,9,36,22,0,"They lied when they said they wanted Tolerance.

They want to be celebrated at every turn and elevated above normal people. 

I'm to a point where I don't care how respectful they are. At best, they're a sad science experiment and at worse they're degenerate filth. Either way, they're all freaks and I'm not calling a man a woman to save their feelings. "
"522",95,"Dranosh",9,9,36,3,0,"Its all about having the power over your life and being able to get you fired and force your views to change and force you to conform to their delusion, thats all this tranny shit is. "
"523",96,"GlipGlop69",9,9,36,2,0,"If assault and murder weren't illegal they'd just attack anyone who slighted them. Remember that when you see these scumbags try to ruin people's lives. What they're doing is basically the ""civil"" stand-in for murder."
"524",37,"Soup_Navy_Admiral",9,1,35,8,0,"&gt; Golden rule should apply to everyone.

Didn't you hear? That's been obsoleted. HR departments are selling the ""Platinum Rule"" as the improved version: ""Treat someone's delusions as truth, even if it's about the invisible mole rat that whispers in their ear."" 

OK, that's not what it says, I think it's ""Treat someone as they want to be treated"", but that's what it boils down to. That platinum rule BS doesn't fly with anyone who's worked retail."
"525",38,"IWantToTalkNow-",9,1,1,12,0,"Tim laid it out in the best terms Ive ever seen.

Progressives believe that calling a trans woman a man is misgendering.

Conservatives believe that calling a trans woman a woman is misgendering.

This is the crux of the issue.  People want to take transgender issue, and stuff it into an easily identifiable box, and it doesnt quite fit properly.  

Why not simply admit that there are biological differences between men and women and at the same time some people are trans.  You can do almost everything with a trans partner that you can do with anyone else.  No, a trans woman will never be able to give birth (and this is often a huge trigger for dysphoria), but outside of that pretty much everything is feminine.  Of course, some trans people pass better than others, and that seems to make a large difference.  Very few people would go out with the GameStop lady, but a metric fuckton would jump at a chance to be with Blaire White.

But then we come to policy.  And policy is a mess of epic proportions when it comes to trans women.  Say, for divorce law purposes, I believe there is no difference between a trans woman and a cis woman.  For sports, do we now allow trans women to compete with cis-women?  Honestly, sometimes theres so little difference, it wouldnt bother me, on the other hand sometimes the difference is so massive that it would be insane to allow.  What about physical health?  If you go to the CDC, and look for what is considered a healthy weight for a woman, that weight is not the same as for trans women in almost all situations due to things like bone density, musculature, etc.  Theyd be close, but not identical.  And once you get into the realm of law and criminal justice, theres even more of a mess.  It becomes a game of consistently splitting hairs.  Some of them dont need to be split, some are pretty important.

The best answer I can find is this:  Treat them like you would anyone else of that gender.  Equally, that applies to recognizing that every group has its crazies, and here, we tend to focus more on the nut job, completely radical trans activists.  Theres plenty of plain ol trans people who just go about their day, think the radicals are just as awful as most people do, and try and make their lives more bearable and look for what everyone else is: meet someone, have a job, have a life and hope its not too shitty.  This should not be a contentious view."
"526",97,"MuhTaxReturns",9,9,38,4,0,"Blaire is hot but her bone structure is quite manly (well not quite, literally). She's a well framed and sturdy boned person. This was really apparent to me when she went on The Rubin Report.

But you are spot on. I assume most Trans people who aren't rage activists just want to live normal boring lives and practically NOBODY has an issue with that -- even the super religious southern person would be like 'whatever'.

It's like back when gay marriage was a hot topic, all the miserable straight married men were like 'if they wanna be miserable like everyone else then so be it'."
"527",98,"Klaus73",9,9,38,3,0,"Speaking about the sports issue; part of the problem is *some* tranwomen argue there is no difference between them an a very gifted female athlete. You got issues like Caster Semenya where they let her compete but unless she was handcapped she destroyed other women (and she isn't even trans she is intersex) so yeah I think there probably needs to be some meeting part way before both sides are willing to just call it as they see it (if I think I see a dude...I use he..not because I despise trans..if I do an you assume I made an honest mistake an ask to be refered to as a she..sure. if you demand I call you a she..then I will extend to you the same respect an goodwill you showed me)"
"528",99,"IWantToTalkNow-",9,9,98,0,0,"Nah, I didn't assume you have any anger or hatred towards trans people, that wouldn't make sense based on what you just said.

I think there's a large grey area when it comes to the sports type thing.  A trans woman who's 5'5 and weighs 130lbs can probably have not much issue competing with other women.  But, if they're taller, heavier, longer before they started transition, and a bunch of other factors, it tends to become pretty unfair to the other women.  And it sucks for trans women who fit that mold.  And there's other scientific differences as well, but I feel this only really applies to competitive sports, especially when people are putting in maximum effort.  These things matter a lot less when you're just say going out to see a movie, or cuddling, they matter almost so little that there's virtually no difference.  

Then you have someone pop up and say ""Hey!  I transitioned!  Why are you saying I still can't do these things?  I'm a woman too, just like them.""  Then comes in all the ideology and radicalism.  

I try to think about things this way, to try and come to a sensible solution:  If you were a parent, and your kid was putting in all the effort for a competitive sport (diet, exercise, practice, money and travel, etc), you'd be real pissed under either situation:  a trans woman who can't compete even though they're dying too and killing themselves too do it, they shouldn't be held back just because they're trans.  Or a cis woman, putting in identical effort, but someone they're competing against has a real, clear, easily demonstratable advantage, they shouldn't be held back because of that.  The competition is supposed to be fair.  But, if you separate trans and cis for competitive purposes, you know there's gonna be a ton of ridicule and mockery aimed at that.  

Basically, it's a mess."
"529",100,"Klaus73",9,9,99,1,0,"Aye I mean is there realistically enough trans population to warrant a trans league?"
"530",39,"Judah_Earl",9,1,1,5,0,"Imagine my shock!ÿ"
"531",40,"Klok_Melagis",9,1,1,4,0,"It's sad that these nuts have hijacked the progressive label when they are far from it. Very ironic they even refer to themselves as progressives considering they are attempting to push us into a 1984-esque sort of era. Walking forward when really they are going backwards."
"532",41,"Gizortnik",9,1,1,9,0,"&gt;Where has anyone ever claimed that ""calling a trans woman a woman is misgendering them""? Does this just stem from the fact most on that side cant grasp that ""gender"" in context is referring to gender identity, not sex as determined at birth?

Amazing. ""It's not misgendering if I don't hear people say it's misgendering in the specific way I want it to be said.""

If conservatives are referring to a transwoman as a man, because she was born as a male, then by definition, calling them a woman, is misgendering a man.

This followed up by a deflection about gender and gender-identity are not the same thing. To bad for you that you're intentionally using double speak since you know good god damned well that there's a difference between gender and gender-identity and you intentionally use *both* in the same way to confuse people.

&gt;Tim. The difference is that the overwhelming majority of us trans women want to be called women. It has nothing to do with ideology, and everything to do with what we want. I don't care what the progressives or the right want, only how I want to be addressed.

Nobody cares how you want to be addressed, and yes it does have to do with ideology. You think that your gender is something that it actually isn't. Or you think your gender-identity doesn't conform to your gender, so therefore you should be referred to as your gender-identity instead of your gender when people refer to your ""gender"". That is based on a social constructionist interpretation of anatomy and physiology. That is explicitly political.

Not only that, but normally when you call anyone *anything* but their name, you are not referring to them how they want to be refereed to, and even then, you didn't ask them what name they would have preferred. So, you want the rest of the world to abide by rules that benefit your concept of a protected class of people, and that you *never* are required to reciprocate.

&gt;And getting rid of transphobia is a bad thing why...?

It's not transphobia you delusional sycophant. That, and it sure as hell isn't the place of hundred million dollar corporations to enforce political and cultural activism.


"
"533",42,"Bithlord",9,1,41,6,0,"&gt;  I don't care what the progressives or the right want, only how I want to be addressed.

I don't care what they want.  I care what I want.  Which..  is a pretty human condition, but at least be honest about it.  "
"534",43,"Klaus73",9,1,1,3,0,"I think the most eriee thing is the ""right to social media quote"" the last thing I want those arses thinking is they have the authority to create/control rights."
"535",44,"Pussrumpa",9,1,1,3,0,"I want to ask how has Tim Pool not been mega-banned and deplatformed forever but I don't want to jinx it. This fucking timeline."
"536",45,"mnemosyne-0002",9,1,1,2,0,"Archives for the links in comments:

* **By [\_theholyghost](https://www.reddit.com/r/KotakuInAction/comments/aq7i5p/_/egdwcyh)** ([quillette.com](https://quillette.com/2019/02/12/it-isnt-your-imagination-twitter-treats-conservatives-more-harshly-than-liberals/)): http://archive.fo/oFZoc
* **By [39Indian](https://www.reddit.com/r/KotakuInAction/comments/aq7i5p/_/egffz9r)** ([theverge.com](https://www.theverge.com/2018/8/31/17801404/mastodon-harassment-wil-wheaton-mobs-twitter)): http://archive.fo/mUx11

----
I am Mnemosyne 2.1, I can't be reasoned with, I can't be bargained with. I don't feel pity of remorse or fear and I absolutely will not stop. Ever. Until unethical news is dead. ^^^^/r/botsrights ^^^^[Contribute](https://github.com/Mnemosyne-20/Mnemosyne-2.1) ^^^^message ^^^^me ^^^^suggestions ^^^^at ^^^^any ^^^^time ^^^^Opt ^^^^out ^^^^of ^^^^tracking ^^^^by ^^^^messaging ^^^^me ^^^^""Opt ^^^^Out"" ^^^^at ^^^^any ^^^^time"
"537",67,"evilplushie",9,4,1,2,0,"No shit. People get banned or suspended for learntocode. Meanwhile saying you want to punch kids is ok

Why do people even use Twitter at this point"
"538",73,"_Doctor_Schlock_",9,6,1,1,0,"Twitter is only 'progressive' in the sense that liberals want representation in the billionaire class AND drone pilot murderers.  Marx or bust bitches!"
"539",86,"maxp84z",9,7,1,0,0,"Oh we know.  That's why we have to get off their platforms.  The president or Don Jr should just make a Twitter clone and the president should switch to that platform.  Then they can moderate the trolls properly.  Imagine if the Patriots had to play every single football game in Philly?  I've been banned from Twitter for over a year now due to my conservative views.  I had 140 followers.  I'm a nobody.   Maybe they were scared i would get 160 followers?"
"540",2,"_theholyghost",10,1,1,74,0,"&gt;Conservatives believe that calling a transwoman a woman is ""misgendering""  
&gt;  
&gt;Progressives believe calling a transwoman a man is ""misgendering""  
&gt;  
&gt;Twitter enforces its policy based on the progressive ideology.  
&gt;  
&gt;Jack confirms they have a bias and enforce the rules based on their bias

Tim Pool quote-retweeted one of Jack Dorsey's earlier replies to Kara Swisher on Twitter last night, the tweet from Dorsey said as follows:

&gt;\[In reference to what Twitter as a platform has done recently to take responsibility for the things that occur on their site\]  
&gt;  
&gt;*1. Misgendering policy for example.*  
&gt;  
&gt;*2. Using ML to downrank bad actors behind interstitials*  
&gt;  
&gt;*3. Not too long ago, but most of our work going forward will have to be product features.*  
&gt;  
&gt;*4. Not sure the question. We put an entire model in place to minimize gaming of the system. #KaraJack*

I encourage people to read through the entire thread between Kara and Jack as it provides more context to the above tweet. It's fascinating to see Twitter as a platform simultaneously banning people based on progressive ideological speech-crimes, whilst claiming that people have a *""right to social media""* and Twitter of course has no political bias against centre-right, right-wing or even libertarian principles and ideas.

Tim also posted a video within the last hour discussing the recent Quillette piece titled [*""It Isn't Your Imagination: Twitter Treats Conservatives More Harshly Than Liberals""*](https://quillette.com/2019/02/12/it-isnt-your-imagination-twitter-treats-conservatives-more-harshly-than-liberals/) which can be [viewed here.](https://www.youtube.com/watch?v=N6gjkEOqgpg)

There was also a [highly-ranked post in this sub](https://www.reddit.com/r/KotakuInAction/comments/aq3zal/censorship_quillette_it_isnt_your_imagination/) regarding the same article today that was posted by /u/md1957 earlier this morning.

What do you guys think can be done about this? Is there any hope for the Twitter platform going forward, do we think that this bias will ever be addressed and/or removed, or is the market truly going to look towards alternative platforms like Gab and Minds for social media moving forward?

***EDIT:*** *Tim just uploaded a video on his second channel discussing this tweet thread and the situation in general -* [*https://www.youtube.com/watch?v=-twtTxoi9Bg*](https://www.youtube.com/watch?v=-twtTxoi9Bg)"
"541",3,"ErikaThePaladin",10,1,2,72,0,"There's no hope for Twitter, since its management is rotten, top to bottom. They don't think there's a bias; they think they're ""doing the right thing""."
"542",4,"Benevolent_Tyrant",10,1,3,17,0,"Remember: They had #ScrewMilo posted in their boardroom from leaked footage.

Totally not biased..."
"543",47,"Castigale",10,3,4,6,0,"I'm sure some find him sexy, but I gotta say, Milo, I wouldn't even screw him. "
"544",71,"rg90184",10,6,47,3,0,"Judging from Milo's husband and the stereotype about black men, I'm sure I would just disappoint Milo. "
"545",48,"revofire",10,3,3,10,0,"This is why things like Mastadon.social will see greater success as time goes on."
"546",59,"39Indian",10,4,48,3,0,"That site is even worse. "
"547",72,"revofire",10,6,59,1,0,"In what ways? It's one site of many in the same fediverse."
"548",74,"39Indian",10,7,72,3,0,"They banned *Wil Wheton* for being too extreme. 


[Twitter rival Mastodon isnt safe from online mobs either
14
The mass reporting of actor Wil Wheaton prompts the platform to examine its moderation tools](https://www.theverge.com/2018/8/31/17801404/mastodon-harassment-wil-wheaton-mobs-twitter)"
"549",87,"UnconcernedUmayyad",10,8,74,1,0,"An instance did, the service literally can't."
"550",5,"Zeriell",10,1,2,41,0,"&gt;  whilst claiming that people have a ""right to social media"" and Twitter of course has no political bias against centre-right

I'm pretty sure they just say this to avoid frightening the center-leftists who might freak out if Twitter outright admitted they are enacting political persecution. No one who works there actually believes it, in my opinion.

It's why I find the calls for Rogan to interview Dorsey again so pointless. It's pretty clear what Dorsey is about at this point. There's no need to try and get him to admit in public what you already know, and what he will never admit. It's like trying to interview an EA executive and get him to, in plain terms, say their business is about destroying companies they acquire by squeezing them dry. "
"551",6,"Tell_me_its_a_dream",10,1,5,21,0,"""right to social media"" means he believes in your right to use another platform after he bans you"
"552",7,"ShinePale",10,1,6,8,0,"It also means if Government does anything to curb his power, then they are abusing people's rights, not just his power to control social narrative."
"553",8,"GlipGlop69",10,1,5,5,0,"I just want somebody who knows about all of this stuff to interview Jack. Someone who isn't afraid to call him out on his bullshit lies as he's trying to push them. People like Jack need to be outsmarted by somebody who knows he's a lying piece of shit. We all know Rogan won't be that guy, Tim Pool could be that guy but we all also know Jack Dorsey will avoid him at all costs since Tim isn't a faggy elitist shill journalist."
"554",9,"Anti-ism",10,1,5,3,0,"The public is still somewhat sensitive to active political persecution. They'll bury their head in the sand about the topic as long as possible as long as you give them some pretext, but if you outright admit you're pursuing it they turn on you. It's....slightly hopeful, in that sense. "
"555",49,"Juicy_Brucesky",10,3,5,2,0,"Let's be honest, that's pure PR vomit. He absolutely doesn't believe it's a right, if he did he'd let the government regulate them - which is the last thing he wants"
"556",60,"Cinnadillo",10,4,5,2,0,"Sort of like how open societies are about closed up organizations run by elites"
"557",10,"Scrappy_The_Crow",10,1,2,15,0,"&gt; Using ML to downrank bad actors behind interstitials

What does that gobbledygook mean?"
"558",11,"B0NES96",10,1,10,20,0,"Pretty sure ML stands for machine learning."
"559",12,"Scrappy_The_Crow",10,1,11,4,0,"Ah, thanks."
"560",13,"blobbybag",10,1,11,4,0,"More shitty Big Tech algorithms. ""Interstitials"" though - vpns?"
"561",14,"B0NES96",10,1,13,8,0,""" **interstitials** are web pages displayed before or after an expected content page, often to display advertisements or confirm the user's age""

I'm not sure that makes sense though in the context of Twitter. VPN does seem to make more sense."
"562",15,"blobbybag",10,1,14,7,0,"I loathe the way people like Dorsey use unnecessary complexity"
"563",16,"Soup_Navy_Admiral",10,1,15,3,0,"Some people would be called on their bullshit more often if they didn't whack every sentence with a thesaurus."
"564",61,"samfishx",10,4,15,1,0,"I knew what an interstitial was... I didnt realize t was that foreign a term"
"565",75,"SRSLovesGawker",10,7,61,2,0,"It has different meanings in different contexts. For instance, in printed circuit board fabbing, an interstitial is a hole connecting two or more layers of a multilayer PCB, but that doesn't go all the way through all the layers of the board."
"566",17,"LouthQuill",10,1,10,10,0,"If you want to know more look up 'unbiasing', 'inclusive machine learning', and 'machine learning fairness'. You should get a bunch of results from google about how to properly apply doublethink in software development. Those are the magic words I always want people like Rogan, congressmen, etc to use when talking to these tech leaders. "
"567",18,"Scrappy_The_Crow",10,1,17,5,0,"&gt; how to properly apply doublethink in software development

That phrase doesn't give me a good feeling."
"568",76,"LouthQuill",10,7,18,3,0,"Oldthinkers unbellyfeel blackwhite. Crimestop and speedful learn plusgood duckspeak.  "
"569",19,"Xenomoly",10,1,10,5,0,"Shadowbanning. "
"570",20,"Scrappy_The_Crow",10,1,19,2,0,"Ah, I see."
