"","id2","user","time","entry","id_par2","comment_score","controversiality","comment"
"1664",131,"IWantToTalkNow-",24,22,130,1,0,"I wouldnt say its purely about a size.  But HRT does affect physical strength, quite clearly.  Im also putting it in context of a co-worker whos trans and is actually both shorter and lighter than that.  There is no way she could ever compete with guys in physical competitive sports, and pretty much 95% of women I know are physically stronger and taller than her.  Basically, not everyone is like the GameStop lady, or the power lifter (who iirc, lifted 130lbs higher than anyone in her weight category, which is ludicrous to allow)

Also read something about bone, especially hip formation and how it affects things, basically men are better built to take a hit, structural.  I understood it to be like shock absorption in men is stronger than in women, but Im very much a layman when it comes to understanding that stuff."
"1665",133,"extortioncontortion",24,23,131,1,0,"my point is that men are much stronger than women on a pound for pound basis.  That is in addition to being larger on average.  Men are better able to put on muscle, and it also looks like we have a better ability to fire off the neurons that control those muscles, resulting about 17% better power generation.  Your hypothetical 5'5"" transwomen has huge advantages going into a competition."
"1666",40,"Judah_Earl",24,1,1,6,0,"Imagine my shock!ÿ"
"1667",41,"Gizortnik",24,1,1,13,0,"&gt;Where has anyone ever claimed that ""calling a trans woman a woman is misgendering them""? Does this just stem from the fact most on that side cant grasp that ""gender"" in context is referring to gender identity, not sex as determined at birth?

Amazing. ""It's not misgendering if I don't hear people say it's misgendering in the specific way I want it to be said.""

If conservatives are referring to a transwoman as a man, because she was born as a male, then by definition, calling them a woman, is misgendering a man.

This followed up by a deflection about gender and gender-identity are not the same thing. To bad for you that you're intentionally using double speak since you know good god damned well that there's a difference between gender and gender-identity and you intentionally use *both* in the same way to confuse people.

&gt;Tim. The difference is that the overwhelming majority of us trans women want to be called women. It has nothing to do with ideology, and everything to do with what we want. I don't care what the progressives or the right want, only how I want to be addressed.

Nobody cares how you want to be addressed, and yes it does have to do with ideology. You think that your gender is something that it actually isn't. Or you think your gender-identity doesn't conform to your gender, so therefore you should be referred to as your gender-identity instead of your gender when people refer to your ""gender"". That is based on a social constructionist interpretation of anatomy and physiology. That is explicitly political.

Not only that, but normally when you call anyone *anything* but their name, you are not referring to them how they want to be refereed to, and even then, you didn't ask them what name they would have preferred. So, you want the rest of the world to abide by rules that benefit your concept of a protected class of people, and that you *never* are required to reciprocate.

&gt;And getting rid of transphobia is a bad thing why...?

It's not transphobia you delusional sycophant. That, and it sure as hell isn't the place of hundred million dollar corporations to enforce political and cultural activism.


"
"1668",42,"Bithlord",24,1,41,8,0,"&gt;  I don't care what the progressives or the right want, only how I want to be addressed.

I don't care what they want.  I care what I want.  Which..  is a pretty human condition, but at least be honest about it.  "
"1669",43,"Klaus73",24,1,1,4,0,"I think the most eriee thing is the ""right to social media quote"" the last thing I want those arses thinking is they have the authority to create/control rights."
"1670",44,"Pussrumpa",24,1,1,3,0,"I want to ask how has Tim Pool not been mega-banned and deplatformed forever but I don't want to jinx it. This fucking timeline."
"1671",45,"evilplushie",24,1,1,3,0,"No shit. People get banned or suspended for learntocode. Meanwhile saying you want to punch kids is ok

Why do people even use Twitter at this point"
"1672",67,"mnemosyne-0002",24,4,1,2,0,"Archives for the links in comments:

* **By [\_theholyghost](https://www.reddit.com/r/KotakuInAction/comments/aq7i5p/_/egdwcyh)** ([quillette.com](https://quillette.com/2019/02/12/it-isnt-your-imagination-twitter-treats-conservatives-more-harshly-than-liberals/)): http://archive.fo/oFZoc
* **By [39Indian](https://www.reddit.com/r/KotakuInAction/comments/aq7i5p/_/egffz9r)** ([theverge.com](https://www.theverge.com/2018/8/31/17801404/mastodon-harassment-wil-wheaton-mobs-twitter)): http://archive.fo/mUx11

----
I am Mnemosyne 2.1, I can't be reasoned with, I can't be bargained with. I don't feel pity of remorse or fear and I absolutely will not stop. Ever. Until unethical news is dead. ^^^^/r/botsrights ^^^^[Contribute](https://github.com/Mnemosyne-20/Mnemosyne-2.1) ^^^^message ^^^^me ^^^^suggestions ^^^^at ^^^^any ^^^^time ^^^^Opt ^^^^out ^^^^of ^^^^tracking ^^^^by ^^^^messaging ^^^^me ^^^^""Opt ^^^^Out"" ^^^^at ^^^^any ^^^^time"
"1673",73,"maxp84z",24,6,1,2,0,"Oh we know.  That's why we have to get off their platforms.  The president or Don Jr should just make a Twitter clone and the president should switch to that platform.  Then they can moderate the trolls properly.  Imagine if the Patriots had to play every single football game in Philly?  I've been banned from Twitter for over a year now due to my conservative views.  I had 140 followers.  I'm a nobody.   Maybe they were scared i would get 160 followers?"
"1674",86,"Roph",24,7,1,1,0,"Wow. Why did this tim guy **tweet** this, instead of make a 10+ minute long video saying the same thing?"
"1675",132,"_Doctor_Schlock_",24,22,1,1,0,"Twitter is only 'progressive' in the sense that liberals want representation in the billionaire class AND drone pilot murderers.  Marx or bust bitches!"
"1676",2,"_theholyghost",25,1,1,87,0,"&gt;Conservatives believe that calling a transwoman a woman is ""misgendering""  
&gt;  
&gt;Progressives believe calling a transwoman a man is ""misgendering""  
&gt;  
&gt;Twitter enforces its policy based on the progressive ideology.  
&gt;  
&gt;Jack confirms they have a bias and enforce the rules based on their bias

Tim Pool quote-retweeted one of Jack Dorsey's earlier replies to Kara Swisher on Twitter last night, the tweet from Dorsey said as follows:

&gt;\[In reference to what Twitter as a platform has done recently to take responsibility for the things that occur on their site\]  
&gt;  
&gt;*1. Misgendering policy for example.*  
&gt;  
&gt;*2. Using ML to downrank bad actors behind interstitials*  
&gt;  
&gt;*3. Not too long ago, but most of our work going forward will have to be product features.*  
&gt;  
&gt;*4. Not sure the question. We put an entire model in place to minimize gaming of the system. #KaraJack*

I encourage people to read through the entire thread between Kara and Jack as it provides more context to the above tweet. It's fascinating to see Twitter as a platform simultaneously banning people based on progressive ideological speech-crimes, whilst claiming that people have a *""right to social media""* and Twitter of course has no political bias against centre-right, right-wing or even libertarian principles and ideas.

Tim also posted a video within the last hour discussing the recent Quillette piece titled [*""It Isn't Your Imagination: Twitter Treats Conservatives More Harshly Than Liberals""*](https://quillette.com/2019/02/12/it-isnt-your-imagination-twitter-treats-conservatives-more-harshly-than-liberals/) which can be [viewed here.](https://www.youtube.com/watch?v=N6gjkEOqgpg)

There was also a [highly-ranked post in this sub](https://www.reddit.com/r/KotakuInAction/comments/aq3zal/censorship_quillette_it_isnt_your_imagination/) regarding the same article today that was posted by /u/md1957 earlier this morning.

What do you guys think can be done about this? Is there any hope for the Twitter platform going forward, do we think that this bias will ever be addressed and/or removed, or is the market truly going to look towards alternative platforms like Gab and Minds for social media moving forward?

***EDIT:*** *Tim just uploaded a video on his second channel discussing this tweet thread and the situation in general -* [*https://www.youtube.com/watch?v=-twtTxoi9Bg*](https://www.youtube.com/watch?v=-twtTxoi9Bg)"
"1677",3,"ErikaThePaladin",25,1,2,82,0,"There's no hope for Twitter, since its management is rotten, top to bottom. They don't think there's a bias; they think they're ""doing the right thing""."
"1678",4,"Benevolent_Tyrant",25,1,3,25,0,"Remember: They had #ScrewMilo posted in their boardroom from leaked footage.

Totally not biased..."
"1679",47,"Castigale",25,3,4,10,0,"I'm sure some find him sexy, but I gotta say, Milo, I wouldn't even screw him. "
"1680",71,"rg90184",25,6,47,6,0,"Judging from Milo's husband and the stereotype about black men, I'm sure I would just disappoint Milo. "
"1681",48,"revofire",25,3,3,7,0,"This is why things like Mastadon.social will see greater success as time goes on."
"1682",59,"39Indian",25,4,48,4,0,"That site is even worse. "
"1683",72,"revofire",25,6,59,1,0,"In what ways? It's one site of many in the same fediverse."
"1684",74,"39Indian",25,7,72,6,0,"They banned *Wil Wheton* for being too extreme. 


[Twitter rival Mastodon isnt safe from online mobs either
14
The mass reporting of actor Wil Wheaton prompts the platform to examine its moderation tools](https://www.theverge.com/2018/8/31/17801404/mastodon-harassment-wil-wheaton-mobs-twitter)"
"1685",87,"UnconcernedUmayyad",25,8,74,2,0,"An instance did, the service literally can't."
"1686",128,"revofire",25,22,74,1,0,"You misunderstand, that's one mastadon instance. Imagine Reddit but decentralized. So imagine that Reddit had no ""admins"" that you had to answer to, just mods. So he joined one of the largest Mastadon instances (so imagine a big subreddit, may or may not be cancer) and had a hard time with the mods of it.

You can leave and join a different and still access the whole community. So... that's what makes it different, if you're banned from one, you can just switch and go somewhere else and rejoin ezpz, no one can stop you effectively short of creating blocklists on their own instances but then those instances can be exiled. 

Essentially, it's a free for all and the free market will decide the fate of instances that decide to censor."
"1687",129,"39Indian",25,22,128,1,0,"Well the decentralization sounds like an improvement."
"1688",5,"Zeriell",25,1,2,42,0,"&gt;  whilst claiming that people have a ""right to social media"" and Twitter of course has no political bias against centre-right

I'm pretty sure they just say this to avoid frightening the center-leftists who might freak out if Twitter outright admitted they are enacting political persecution. No one who works there actually believes it, in my opinion.

It's why I find the calls for Rogan to interview Dorsey again so pointless. It's pretty clear what Dorsey is about at this point. There's no need to try and get him to admit in public what you already know, and what he will never admit. It's like trying to interview an EA executive and get him to, in plain terms, say their business is about destroying companies they acquire by squeezing them dry. "
"1689",6,"Tell_me_its_a_dream",25,1,5,23,0,"""right to social media"" means he believes in your right to use another platform after he bans you"
"1690",7,"ShinePale",25,1,6,11,0,"It also means if Government does anything to curb his power, then they are abusing people's rights, not just his power to control social narrative."
"1691",8,"GlipGlop69",25,1,5,6,0,"I just want somebody who knows about all of this stuff to interview Jack. Someone who isn't afraid to call him out on his bullshit lies as he's trying to push them. People like Jack need to be outsmarted by somebody who knows he's a lying piece of shit. We all know Rogan won't be that guy, Tim Pool could be that guy but we all also know Jack Dorsey will avoid him at all costs since Tim isn't a faggy elitist shill journalist."
"1692",9,"Anti-ism",25,1,5,6,0,"The public is still somewhat sensitive to active political persecution. They'll bury their head in the sand about the topic as long as possible as long as you give them some pretext, but if you outright admit you're pursuing it they turn on you. It's....slightly hopeful, in that sense. "
"1693",49,"Juicy_Brucesky",25,3,5,3,0,"Let's be honest, that's pure PR vomit. He absolutely doesn't believe it's a right, if he did he'd let the government regulate them - which is the last thing he wants"
"1694",60,"Cinnadillo",25,4,5,3,0,"Sort of like how open societies are about closed up organizations run by elites"
"1695",10,"Gizortnik",25,1,2,17,0,"&gt; What do you guys think can be done about this? 

Move to Minds or Gab

&gt;Is there any hope for the Twitter platform going forward

No.

&gt;do we think that this bias will ever be addressed and/or removed

No.

&gt;or is the market truly going to look towards alternative platforms like Gab and Minds for social media moving forward?

Yes, slowly. It takes time for people to change their habits.

Twitter is now mostly funded by investment based off of fraudulent stats and by journalists. So, in order to not destroy Twitter, twitter will need to *flooded* by *hundreds of millions of dollars and users* from conservatives, or *all of journalism will simultaneously become neutral*.

That, or Twitter dies when the investors realize how much they've been defrauded.
"
"1696",11,"Juicy_Brucesky",25,1,10,5,0,"Here's the problem with minds and gab. Before the conservatives are slowly kicked off the main platforms, the ACTUAL racists and other shitty people were banned and moved to these places first.






So it puts conservatives into a place with actual racists and then the left can point and say ""see they are over there hanging with racists""







Voat has the same problem. So while it's great these places don't go heavy on censorship, as a result the real dregs of society tend to control the overall content of it and as you can imagine it's an overwhelming amount of disgusting trash"
"1697",12,"Gizortnik",25,1,11,2,0,"I haven't noticed that on either site, particularly not Minds because I can see my subscriptions quite easily. You'll normally find me hanging out at the Subverse Newsroom (Group) at this point."
"1698",22,"Scrappy_The_Crow",25,1,2,16,0,"&gt; Using ML to downrank bad actors behind interstitials

What does that gobbledygook mean?"
"1699",77,"B0NES96",25,7,22,20,0,"Pretty sure ML stands for machine learning."
"1700",78,"blobbybag",25,7,77,7,0,"More shitty Big Tech algorithms. ""Interstitials"" though - vpns?"
"1701",108,"B0NES96",25,16,78,7,0,""" **interstitials** are web pages displayed before or after an expected content page, often to display advertisements or confirm the user's age""

I'm not sure that makes sense though in the context of Twitter. VPN does seem to make more sense."
"1702",109,"blobbybag",25,16,108,7,0,"I loathe the way people like Dorsey use unnecessary complexity"
"1703",110,"Soup_Navy_Admiral",25,16,109,3,0,"Some people would be called on their bullshit more often if they didn't whack every sentence with a thesaurus."
"1704",111,"samfishx",25,16,109,2,0,"I knew what an interstitial was... I didnt realize t was that foreign a term"
"1705",112,"SRSLovesGawker",25,16,111,3,0,"It has different meanings in different contexts. For instance, in printed circuit board fabbing, an interstitial is a hole connecting two or more layers of a multilayer PCB, but that doesn't go all the way through all the layers of the board."
"1706",113,"Scrappy_The_Crow",25,16,77,6,0,"Ah, thanks."
"1707",114,"LouthQuill",25,16,22,9,0,"If you want to know more look up 'unbiasing', 'inclusive machine learning', and 'machine learning fairness'. You should get a bunch of results from google about how to properly apply doublethink in software development. Those are the magic words I always want people like Rogan, congressmen, etc to use when talking to these tech leaders. "
"1708",115,"Scrappy_The_Crow",25,16,114,5,0,"&gt; how to properly apply doublethink in software development

That phrase doesn't give me a good feeling."
"1709",116,"LouthQuill",25,16,115,8,0,"Oldthinkers unbellyfeel blackwhite. Crimestop and speedful learn plusgood duckspeak.  "
"1710",117,"Xenomoly",25,16,22,4,0,"Shadowbanning. "
"1711",118,"Scrappy_The_Crow",25,16,117,2,0,"Ah, I see."
"1712",23,"Muskaos",25,1,2,7,0,"&gt;What do you guys think can be done about this? Is there any hope for the Twitter platform going forward, do we think that this bias will ever be addressed and/or removed, or is the market truly going to look towards alternative platforms like Gab and Minds for social media moving forward?

Twitter needs to lose it's Chapter 230 exemption to the Communication Decency Act. Only government can do that.

Once that happens, the pain of loosing tens of millions of dollars to lawsuits will bring them in line.

Either that, or they go broke, like they deserve to."
"1713",24,"mrmensplights",25,1,2,7,0,"The left doesn't believe they are biased because they don't believe in different points of view on politics (or their acceptable range is very narrow). They think their point of view is the moral standard; a matter of good and evil.

So from Twitters perspective they are both unbiased and also just banning bad people.

Conservatives know better because they stand behind free speech. Can't really do that and also believe someone with different ideas is evil.  Wrong sure, but bot necessarily evil.

Conservatives also have a richer tradition of intellectual diversity anyway. It's more a confederation of groups than the monolith the left is. A monolith that lets their extremists take over the whole show.

"
"1714",25,"Xenomoly",25,1,2,6,0,"Twitter is a trashfire.  I left it years ago and don't have any desire to jump back into it. "
"1715",64,"Anti-ism",25,4,2,4,0,"I actually do think there's some hope for Twitter because Jack seems like a guy who's basically dumb about this stuff as opposed to a committed ideologue. Like, he believes in it, but it's because the media and entertainment have always told him its right rather than some personal pursuit of it. 

But it's a small hope."
"1716",119,"KasumiKagura",25,16,64,5,0,"The reason Twitter is so fucked right now is because of journalists. Right now the only thing keeping twitter alive is trolls and outrage and right now outrage is whats driving people to the platform.

However that is slowly dwindling. The more Covington type blunders happen, the more libel lawsuits will happen the more careful journalists will be in stoking outrage. When these trust fund kiddies find out there is consequences to their lies and slander, the more they find their pockets empty and needing to scrape by with just ramen noodles, the more they lose their jobs because of their incompetence and failed gender studies degrees, the less twitter will be sustained by them, and the less of a shit twitter will give about them. "
"1717",120,"Splutch",25,16,64,4,0,"I'm starting to think that about all of these socially awkward (actual, not hipster) geeks and programmers."
"1718",121,"_theholyghost",25,16,120,8,0,"Jack Conté appears to be spiralling following the Patreon/Sargon backlash, crying and begging with his audience, promising to serve them and provide the platform he thinks is right for his people. It's woefully pathetic given the responsibility he has as CEO of Patreon. "
"1719",122,"Splutch",25,16,121,6,0,"I saw that.  I don't think I've ever seen a more obvious display of fake crying in my life.  "
"1720",69,"kriegson",25,5,2,4,0,"&gt;Cultural Colonelism, essentially?  They've become what they hate the most.  

An excellent point and what a surprise...totalitarians demand you act, speak and think as they desire."
"1721",26,"Lhasadog",25,1,1,26,0,"Wow! Im thinking Jacks Lawyers want to shoot him right now. Remember he was just sued, yesterday, by Feminist Journalist Meagan Murphy for banning her for saying Men are not Women. Jack just said her suit has merit.well done you brave progressive pinhead. I think Jack May actually come off as less appealing than Denton when it hits a jury. "
"1722",27,"paranoidandroid1984",25,1,26,6,0,"His personal lawyer is probably incredibly happy with Jack. Twitter general council, on the other hand, may consider homicide. "
"1723",28,"luckierbridgeandrail",25,1,27,11,0,"&gt; His personal lawyer is probably incredibly happy with Jack. 

Billable hours are billable hours.
"
"1724",34,"npc435646",25,1,1,13,0,"STOP calling it progressive, it's not."
"1725",50,"LordCloverskull",25,3,34,3,0,"I mean, it is progressing society towards a goal. That goal may be cancer incarnate, but it its still progression, if only technically. "
"1726",35,"IronWolve",25,1,1,46,0,"Misgendering is bannable, calls for violence against a kid wearing a MAGA hat isn't.   

btw, I think misgendering can be rude in some circumstances, treat everyone with some respect, even if you don't agree with them.  Golden rule should apply to everyone. 
"
"1727",36,"throwaway2348907987",25,1,35,50,0,"Respect goes both ways. If you believe someone claiming to be a woman is a man and that person tries to browbeat you into changing your views, often violently, and at the cost of your professional life that's not very respectful of your beliefs either.

IMO the transgenders are the ones being very disrespectful with their
&gt;I'll have your job, shithead

behavior. Trying to personally and professional destroy someone you don't know just because they have different beliefs is very tyrannical and dehumanizing."
"1728",90,"IronWolve",25,9,36,31,0,"I work in tech, lots of transgenders in tech, male to female.  Never had a problem using their preferred pronoun, but we never talked about politics.  (thank goodness)

I actually hate that Transgender is being pushed on gay men and kids.  My kids and friends kids all said there is a spike in transgender in our kids junoir high schools in Seattle.   Its stupid that its becoming a trend, when its a real medical issue for people and being political.  Medical issues shouldnt be treated as a FAD, imho. "
"1729",91,"throwaway2348907987",25,9,90,26,0,"There are a ton of other people who would prefer to say the emperor has no clothes but the price of a public freakout is not worth it and no one will defend them anyway. They feel like they're being forced to participate in a lie."
"1730",92,"PrettyDecentSort",25,9,90,10,0,"&gt; I work in tech, lots of transgenders in tech, male to female

This is not true of tech worldwide nor even nationwide. It may be true of the I-5 corridor, but silicon valley is not synonymous with ""tech""."
"1731",93,"Muskaos",25,9,36,11,0,"Anyone who knows how the left works should have expected this modern day inquisition. The radical left never does things for tolerance, they do things to bend amenable authority to their will. What they really want is to use government agents to enjoin abject grovelling by their hated enemies at gunpoint. For radical gays, this means Christianity. For Trans, this means the rest of society that is normal."
"1732",94,"BadEnough",25,9,36,22,0,"They lied when they said they wanted Tolerance.

They want to be celebrated at every turn and elevated above normal people. 

I'm to a point where I don't care how respectful they are. At best, they're a sad science experiment and at worse they're degenerate filth. Either way, they're all freaks and I'm not calling a man a woman to save their feelings. "
"1733",95,"GlipGlop69",25,9,36,6,0,"If assault and murder weren't illegal they'd just attack anyone who slighted them. Remember that when you see these scumbags try to ruin people's lives. What they're doing is basically the ""civil"" stand-in for murder."
"1734",96,"AnarcrotheAlchemist",25,9,36,4,0,"I had a discussion with someone on reddit two days ago about this topic. 

I said I will avoid using pronouns for these people and just use their name but I'm not going to lie to protect their feelings. The guy just couldn't accept that I consider it lying to use pronouns that don't match their biology."
"1735",102,"Dranosh",25,14,36,3,0,"Its all about having the power over your life and being able to get you fired and force your views to change and force you to conform to their delusion, thats all this tranny shit is. "
"1736",37,"Soup_Navy_Admiral",25,1,35,8,0,"&gt; Golden rule should apply to everyone.

Didn't you hear? That's been obsoleted. HR departments are selling the ""Platinum Rule"" as the improved version: ""Treat someone's delusions as truth, even if it's about the invisible mole rat that whispers in their ear."" 

OK, that's not what it says, I think it's ""Treat someone as they want to be treated"", but that's what it boils down to. That platinum rule BS doesn't fly with anyone who's worked retail."
"1737",103,"Alamasy",25,14,35,2,0,"You could argue with misgendering but learntocode is considered worse than a death threat wtf."
"1738",38,"Klok_Melagis",25,1,1,6,0,"It's sad that these nuts have hijacked the progressive label when they are far from it. Very ironic they even refer to themselves as progressives considering they are attempting to push us into a 1984-esque sort of era. Walking forward when really they are going backwards."
