"","id2","user","time","entry","id_par2","comment_score","controversiality","comment"
"1",1,"_theholyghost",1,1,1,999,999,"x"
"2",2,"_theholyghost",1,1,1,54,0,"&gt;Conservatives believe that calling a transwoman a woman is ""misgendering""  
&gt;  
&gt;Progressives believe calling a transwoman a man is ""misgendering""  
&gt;  
&gt;Twitter enforces its policy based on the progressive ideology.  
&gt;  
&gt;Jack confirms they have a bias and enforce the rules based on their bias

Tim Pool quote-retweeted one of Jack Dorsey's earlier replies to Kara Swisher on Twitter last night, the tweet from Dorsey said as follows:

&gt;\[In reference to what Twitter as a platform has done recently to take responsibility for the things that occur on their site\]  
&gt;  
&gt;*1. Misgendering policy for example.*  
&gt;  
&gt;*2. Using ML to downrank bad actors behind interstitials*  
&gt;  
&gt;*3. Not too long ago, but most of our work going forward will have to be product features.*  
&gt;  
&gt;*4. Not sure the question. We put an entire model in place to minimize gaming of the system. #KaraJack*

I encourage people to read through the entire thread between Kara and Jack as it provides more context to the above tweet. It's fascinating to see Twitter as a platform simultaneously banning people based on progressive ideological speech-crimes, whilst claiming that people have a *""right to social media""* and Twitter of course has no political bias against centre-right, right-wing or even libertarian principles and ideas.

Tim also posted a video within the last hour discussing the recent Quillette piece titled [*""It Isn't Your Imagination: Twitter Treats Conservatives More Harshly Than Liberals""*](https://quillette.com/2019/02/12/it-isnt-your-imagination-twitter-treats-conservatives-more-harshly-than-liberals/) which can be [viewed here.](https://www.youtube.com/watch?v=N6gjkEOqgpg)

There was also a [highly-ranked post in this sub](https://www.reddit.com/r/KotakuInAction/comments/aq3zal/censorship_quillette_it_isnt_your_imagination/) regarding the same article today that was posted by /u/md1957 earlier this morning.

What do you guys think can be done about this? Is there any hope for the Twitter platform going forward, do we think that this bias will ever be addressed and/or removed, or is the market truly going to look towards alternative platforms like Gab and Minds for social media moving forward?"
"3",3,"ErikaThePaladin",1,1,2,49,0,"There's no hope for Twitter, since its management is rotten, top to bottom. They don't think there's a bias; they think they're ""doing the right thing""."
"4",4,"revofire",1,1,3,8,0,"This is why things like Mastadon.social will see greater success as time goes on."
"5",5,"Zeriell",1,1,2,25,0,"&gt;  whilst claiming that people have a ""right to social media"" and Twitter of course has no political bias against centre-right

I'm pretty sure they just say this to avoid frightening the center-leftists who might freak out if Twitter outright admitted they are enacting political persecution. No one who works there actually believes it, in my opinion.

It's why I find the calls for Rogan to interview Dorsey again so pointless. It's pretty clear what Dorsey is about at this point. There's no need to try and get him to admit in public what you already know, and what he will never admit. It's like trying to interview an EA executive and get him to, in plain terms, say their business is about destroying companies they acquire by squeezing them dry. "
"6",6,"Tell_me_its_a_dream",1,1,5,12,0,"""right to social media"" means he believes in your right to use another platform after he bans you"
"7",7,"ShinePale",1,1,6,5,0,"It also means if Government does anything to curb his power, then they are abusing people's rights, not just his power to control social narrative."
"8",8,"Anti-ism",1,1,5,2,0,"The public is still somewhat sensitive to active political persecution. They'll bury their head in the sand about the topic as long as possible as long as you give them some pretext, but if you outright admit you're pursuing it they turn on you. It's....slightly hopeful, in that sense. "
"9",9,"Juicy_Brucesky",1,1,5,1,0,"Let's be honest, that's pure PR vomit. He absolutely doesn't believe it's a right, if he did he'd let the government regulate them - which is the last thing he wants"
"10",10,"Scrappy_The_Crow",1,1,2,11,0,"&gt; Using ML to downrank bad actors behind interstitials

What does that gobbledygook mean?"
"11",11,"B0NES96",1,1,10,13,0,"Pretty sure ML stands for machine learning."
"12",12,"Scrappy_The_Crow",1,1,11,3,0,"Ah, thanks."
"13",13,"blobbybag",1,1,11,2,0,"More shitty Big Tech algorithms. ""Interstitials"" though - vpns?"
"14",14,"B0NES96",1,1,13,3,0,""" **interstitials** are web pages displayed before or after an expected content page, often to display advertisements or confirm the user's age""

I'm not sure that makes sense though in the context of Twitter. VPN does seem to make more sense."
"15",15,"blobbybag",1,1,14,3,0,"I loathe the way people like Dorsey use unnecessary complexity"
"16",16,"Soup_Navy_Admiral",1,1,15,1,0,"Some people would be called on their bullshit more often if they didn't whack every sentence with a thesaurus."
"17",17,"Xenomoly",1,1,10,6,0,"Shadowbanning. "
"18",18,"Scrappy_The_Crow",1,1,17,2,0,"Ah, I see."
"19",19,"LouthQuill",1,1,10,3,0,"If you want to know more look up 'unbiasing', 'inclusive machine learning', and 'machine learning fairness'. You should get a bunch of results from google about how to properly apply doublethink in software development. Those are the magic words I always want people like Rogan, congressmen, etc to use when talking to these tech leaders. "
"20",20,"Scrappy_The_Crow",1,1,19,1,0,"&gt; how to properly apply doublethink in software development

That phrase doesn't give me a good feeling."
"21",21,"LouthQuill",1,1,20,1,0,"Oldthinkers unbellyfeel blackwhite. Crimestop and speedful learn plusgood duckspeak.  "
"22",22,"Gizortnik",1,1,2,13,0,"&gt; What do you guys think can be done about this? 

Move to Minds or Gab

&gt;Is there any hope for the Twitter platform going forward

No.

&gt;do we think that this bias will ever be addressed and/or removed

No.

&gt;or is the market truly going to look towards alternative platforms like Gab and Minds for social media moving forward?

Yes, slowly. It takes time for people to change their habits.

Twitter is now mostly funded by investment based off of fraudulent stats and by journalists. So, in order to not destroy Twitter, twitter will need to *flooded* by *hundreds of millions of dollars and users* from conservatives, or *all of journalism will simultaneously become neutral*.

That, or Twitter dies when the investors realize how much they've been defrauded.
"
"23",23,"Xenomoly",1,1,2,4,0,"Twitter is a trashfire.  I left it years ago and don't have any desire to jump back into it. "
"24",24,"Anti-ism",1,1,2,2,0,"I actually do think there's some hope for Twitter because Jack seems like a guy who's basically dumb about this stuff as opposed to a committed ideologue. Like, he believes in it, but it's because the media and entertainment have always told him its right rather than some personal pursuit of it. 

But it's a small hope."
"25",25,"Muskaos",1,1,2,1,0,"&gt;What do you guys think can be done about this? Is there any hope for the Twitter platform going forward, do we think that this bias will ever be addressed and/or removed, or is the market truly going to look towards alternative platforms like Gab and Minds for social media moving forward?

Twitter needs to lose it's Chapter 230 exemption to the Communication Decency Act. Only government can do that.

Once that happens, the pain of loosing tens of millions of dollars to lawsuits will bring them in line.

Either that, or they go broke, like they deserve to."
"26",26,"IronWolve",1,1,1,23,0,"Misgendering is bannable, calls for violence against a kid wearing a MAGA hat isn't.   

btw, I think misgendering can be rude in some circumstances, treat everyone with some respect, even if you don't agree with them.  Golden rule should apply to everyone. 
"
"27",27,"throwaway2348907987",1,1,26,23,0,"Respect goes both ways. If you believe someone claiming to be a woman is a man and that person tries to browbeat you into changing your views, often violently, and at the cost of your professional life that's not very respectful of your beliefs either.

IMO the transgenders are the ones being very disrespectful with their
&gt;I'll have your job, shithead

behavior. Trying to personally and professional destroy someone you don't know just because they have different beliefs is very tyrannical and dehumanizing."
"28",28,"IronWolve",1,1,27,15,0,"I work in tech, lots of transgenders in tech, male to female.  Never had a problem using their preferred pronoun, but we never talked about politics.  (thank goodness)

I actually hate that Transgender is being pushed on gay men and kids.  My kids and friends kids all said there is a spike in transgender in our kids junoir high schools in Seattle.   Its stupid that its becoming a trend, when its a real medical issue for people and being political.  Medical issues shouldnt be treated as a FAD, imho. "
"29",29,"throwaway2348907987",1,1,28,6,0,"There are a ton of other people who would prefer to say the emperor has no clothes but the price of a public freakout is not worth it and no one will defend them anyway. They feel like they're being forced to participate in a lie."
"30",30,"PrettyDecentSort",1,1,28,1,0,"&gt; I work in tech, lots of transgenders in tech, male to female

This is not true of tech worldwide nor even nationwide. It may be true of the I-5 corridor, but silicon valley is not synonymous with ""tech""."
"31",31,"BadEnough",1,1,27,14,0,"They lied when they said they wanted Tolerance.

They want to be celebrated at every turn and elevated above normal people. 

I'm to a point where I don't care how respectful they are. At best, they're a sad science experiment and at worse they're degenerate filth. Either way, they're all freaks and I'm not calling a man a woman to save their feelings. "
"32",32,"Muskaos",1,1,27,1,0,"Anyone who knows how the left works should have expected this modern day inquisition. The radical left never does things for tolerance, they do things to bend amenable authority to their will. What they really want is to use government agents to enjoin abject grovelling by their hated enemies at gunpoint. For radical gays, this means Christianity. For Trans, this means the rest of society that is normal."
"33",33,"Soup_Navy_Admiral",1,1,26,3,0,"&gt; Golden rule should apply to everyone.

Didn't you hear? That's been obsoleted. HR departments are selling the ""Platinum Rule"" as the improved version: ""Treat someone's delusions as truth, even if it's about the invisible mole rat that whispers in their ear."" 

OK, that's not what it says, I think it's ""Treat someone as they want to be treated"", but that's what it boils down to. That platinum rule BS doesn't fly with anyone who's worked retail."
"34",34,"Lhasadog",1,1,1,10,0,"Wow! Im thinking Jacks Lawyers want to shoot him right now. Remember he was just sued, yesterday, by Feminist Journalist Meagan Murphy for banning her for saying Men are not Women. Jack just said her suit has merit.well done you brave progressive pinhead. I think Jack May actually come off as less appealing than Denton when it hits a jury. "
"35",35,"IWantToTalkNow-",1,1,1,12,0,"Tim laid it out in the best terms Ive ever seen.

Progressives believe that calling a trans woman a man is misgendering.

Conservatives believe that calling a trans woman a woman is misgendering.

This is the crux of the issue.  People want to take transgender issue, and stuff it into an easily identifiable box, and it doesnt quite fit properly.  

Why not simply admit that there are biological differences between men and women and at the same time some people are trans.  You can do almost everything with a trans partner that you can do with anyone else.  No, a trans woman will never be able to give birth (and this is often a huge trigger for dysphoria), but outside of that pretty much everything is feminine.  Of course, some trans people pass better than others, and that seems to make a large difference.  Very few people would go out with the GameStop lady, but a metric fuckton would jump at a chance to be with Blaire White.

But then we come to policy.  And policy is a mess of epic proportions when it comes to trans women.  Say, for divorce law purposes, I believe there is no difference between a trans woman and a cis woman.  For sports, do we now allow trans women to compete with cis-women?  Honestly, sometimes theres so little difference, it wouldnt bother me, on the other hand sometimes the difference is so massive that it would be insane to allow.  What about physical health?  If you go to the CDC, and look for what is considered a healthy weight for a woman, that weight is not the same as for trans women in almost all situations due to things like bone density, musculature, etc.  Theyd be close, but not identical.  And once you get into the realm of law and criminal justice, theres even more of a mess.  It becomes a game of consistently splitting hairs.  Some of them dont need to be split, some are pretty important.

The best answer I can find is this:  Treat them like you would anyone else of that gender.  Equally, that applies to recognizing that every group has its crazies, and here, we tend to focus more on the nut job, completely radical trans activists.  Theres plenty of plain ol trans people who just go about their day, think the radicals are just as awful as most people do, and try and make their lives more bearable and look for what everyone else is: meet someone, have a job, have a life and hope its not too shitty.  This should not be a contentious view."
"36",36,"MuhTaxReturns",1,1,35,4,0,"Blaire is hot but her bone structure is quite manly (well not quite, literally). She's a well framed and sturdy boned person. This was really apparent to me when she went on The Rubin Report.

But you are spot on. I assume most Trans people who aren't rage activists just want to live normal boring lives and practically NOBODY has an issue with that -- even the super religious southern person would be like 'whatever'.

It's like back when gay marriage was a hot topic, all the miserable straight married men were like 'if they wanna be miserable like everyone else then so be it'."
"37",37,"Klaus73",1,1,35,2,0,"Speaking about the sports issue; part of the problem is *some* tranwomen argue there is no difference between them an a very gifted female athlete. You got issues like Caster Semenya where they let her compete but unless she was handcapped she destroyed other women (and she isn't even trans she is intersex) so yeah I think there probably needs to be some meeting part way before both sides are willing to just call it as they see it (if I think I see a dude...I use he..not because I despise trans..if I do an you assume I made an honest mistake an ask to be refered to as a she..sure. if you demand I call you a she..then I will extend to you the same respect an goodwill you showed me)"
"38",38,"Judah_Earl",1,1,1,5,0,"Imagine my shock!ÿ"
"39",39,"npc435646",1,1,1,4,0,"STOP calling it progressive, it's not."
"40",40,"Klaus73",1,1,1,3,0,"I think the most eriee thing is the ""right to social media quote"" the last thing I want those arses thinking is they have the authority to create/control rights."
"41",41,"Gizortnik",1,1,1,8,0,"&gt;Where has anyone ever claimed that ""calling a trans woman a woman is misgendering them""? Does this just stem from the fact most on that side cant grasp that ""gender"" in context is referring to gender identity, not sex as determined at birth?

Amazing. ""It's not misgendering if I don't hear people say it's misgendering in the specific way I want it to be said.""

If conservatives are referring to a transwoman as a man, because she was born as a male, then by definition, calling them a woman, is misgendering a man.

This followed up by a deflection about gender and gender-identity are not the same thing. To bad for you that you're intentionally using double speak since you know good god damned well that there's a difference between gender and gender-identity and you intentionally use *both* in the same way to confuse people.

&gt;Tim. The difference is that the overwhelming majority of us trans women want to be called women. It has nothing to do with ideology, and everything to do with what we want. I don't care what the progressives or the right want, only how I want to be addressed.

Nobody cares how you want to be addressed, and yes it does have to do with ideology. You think that your gender is something that it actually isn't. Or you think your gender-identity doesn't conform to your gender, so therefore you should be referred to as your gender-identity instead of your gender when people refer to your ""gender"". That is based on a social constructionist interpretation of anatomy and physiology. That is explicitly political.

Not only that, but normally when you call anyone *anything* but their name, you are not referring to them how they want to be refereed to, and even then, you didn't ask them what name they would have preferred. So, you want the rest of the world to abide by rules that benefit your concept of a protected class of people, and that you *never* are required to reciprocate.

&gt;And getting rid of transphobia is a bad thing why...?

It's not transphobia you delusional sycophant. That, and it sure as hell isn't the place of hundred million dollar corporations to enforce political and cultural activism.


"
"42",42,"Bithlord",1,1,41,6,0,"&gt;  I don't care what the progressives or the right want, only how I want to be addressed.

I don't care what they want.  I care what I want.  Which..  is a pretty human condition, but at least be honest about it.  "
"43",43,"mnemosyne-0002",1,1,1,2,0,"Archives for the links in comments:

* **By [\_theholyghost](https://www.reddit.com/r/KotakuInAction/comments/aq7i5p/_/egdwcyh)** ([quillette.com](https://quillette.com/2019/02/12/it-isnt-your-imagination-twitter-treats-conservatives-more-harshly-than-liberals/)): http://archive.fo/oFZoc

----
I am Mnemosyne 2.1, I can't be reasoned with, I can't be bargained with. I don't feel pity of remorse or fear and I absolutely will not stop. Ever. Until unethical news is dead. ^^^^/r/botsrights ^^^^[Contribute](https://github.com/Mnemosyne-20/Mnemosyne-2.1) ^^^^message ^^^^me ^^^^suggestions ^^^^at ^^^^any ^^^^time ^^^^Opt ^^^^out ^^^^of ^^^^tracking ^^^^by ^^^^messaging ^^^^me ^^^^""Opt ^^^^Out"" ^^^^at ^^^^any ^^^^time"
"44",44,"Klok_Melagis",1,1,1,2,0,"It's sad that these nuts have hijacked the progressive label when they are far from it. Very ironic they even refer to themselves as progressives considering they are attempting to push us into a 1984-esque sort of era. Walking forward when really they are going backwards."
"45",45,"_Doctor_Schlock_",1,1,1,1,0,"Twitter is only 'progressive' in the sense that liberals want representation in the billionaire class AND drone pilot murderers.  Marx or bust bitches!"
"46",2,"_theholyghost",2,1,1,59,0,"&gt;Conservatives believe that calling a transwoman a woman is ""misgendering""  
&gt;  
&gt;Progressives believe calling a transwoman a man is ""misgendering""  
&gt;  
&gt;Twitter enforces its policy based on the progressive ideology.  
&gt;  
&gt;Jack confirms they have a bias and enforce the rules based on their bias

Tim Pool quote-retweeted one of Jack Dorsey's earlier replies to Kara Swisher on Twitter last night, the tweet from Dorsey said as follows:

&gt;\[In reference to what Twitter as a platform has done recently to take responsibility for the things that occur on their site\]  
&gt;  
&gt;*1. Misgendering policy for example.*  
&gt;  
&gt;*2. Using ML to downrank bad actors behind interstitials*  
&gt;  
&gt;*3. Not too long ago, but most of our work going forward will have to be product features.*  
&gt;  
&gt;*4. Not sure the question. We put an entire model in place to minimize gaming of the system. #KaraJack*

I encourage people to read through the entire thread between Kara and Jack as it provides more context to the above tweet. It's fascinating to see Twitter as a platform simultaneously banning people based on progressive ideological speech-crimes, whilst claiming that people have a *""right to social media""* and Twitter of course has no political bias against centre-right, right-wing or even libertarian principles and ideas.

Tim also posted a video within the last hour discussing the recent Quillette piece titled [*""It Isn't Your Imagination: Twitter Treats Conservatives More Harshly Than Liberals""*](https://quillette.com/2019/02/12/it-isnt-your-imagination-twitter-treats-conservatives-more-harshly-than-liberals/) which can be [viewed here.](https://www.youtube.com/watch?v=N6gjkEOqgpg)

There was also a [highly-ranked post in this sub](https://www.reddit.com/r/KotakuInAction/comments/aq3zal/censorship_quillette_it_isnt_your_imagination/) regarding the same article today that was posted by /u/md1957 earlier this morning.

What do you guys think can be done about this? Is there any hope for the Twitter platform going forward, do we think that this bias will ever be addressed and/or removed, or is the market truly going to look towards alternative platforms like Gab and Minds for social media moving forward?"
"47",3,"ErikaThePaladin",2,1,2,54,0,"There's no hope for Twitter, since its management is rotten, top to bottom. They don't think there's a bias; they think they're ""doing the right thing""."
"48",4,"revofire",2,1,3,8,0,"This is why things like Mastadon.social will see greater success as time goes on."
"49",5,"Zeriell",2,1,2,31,0,"&gt;  whilst claiming that people have a ""right to social media"" and Twitter of course has no political bias against centre-right

I'm pretty sure they just say this to avoid frightening the center-leftists who might freak out if Twitter outright admitted they are enacting political persecution. No one who works there actually believes it, in my opinion.

It's why I find the calls for Rogan to interview Dorsey again so pointless. It's pretty clear what Dorsey is about at this point. There's no need to try and get him to admit in public what you already know, and what he will never admit. It's like trying to interview an EA executive and get him to, in plain terms, say their business is about destroying companies they acquire by squeezing them dry. "
"50",6,"Tell_me_its_a_dream",2,1,5,15,0,"""right to social media"" means he believes in your right to use another platform after he bans you"
"51",7,"ShinePale",2,1,6,5,0,"It also means if Government does anything to curb his power, then they are abusing people's rights, not just his power to control social narrative."
"52",8,"Anti-ism",2,1,5,2,0,"The public is still somewhat sensitive to active political persecution. They'll bury their head in the sand about the topic as long as possible as long as you give them some pretext, but if you outright admit you're pursuing it they turn on you. It's....slightly hopeful, in that sense. "
"53",9,"Juicy_Brucesky",2,1,5,1,0,"Let's be honest, that's pure PR vomit. He absolutely doesn't believe it's a right, if he did he'd let the government regulate them - which is the last thing he wants"
"54",10,"Scrappy_The_Crow",2,1,2,14,0,"&gt; Using ML to downrank bad actors behind interstitials

What does that gobbledygook mean?"
"55",11,"B0NES96",2,1,10,13,0,"Pretty sure ML stands for machine learning."
"56",12,"Scrappy_The_Crow",2,1,11,3,0,"Ah, thanks."
"57",13,"blobbybag",2,1,11,2,0,"More shitty Big Tech algorithms. ""Interstitials"" though - vpns?"
"58",14,"B0NES96",2,1,13,5,0,""" **interstitials** are web pages displayed before or after an expected content page, often to display advertisements or confirm the user's age""

I'm not sure that makes sense though in the context of Twitter. VPN does seem to make more sense."
"59",15,"blobbybag",2,1,14,3,0,"I loathe the way people like Dorsey use unnecessary complexity"
"60",16,"Soup_Navy_Admiral",2,1,15,1,0,"Some people would be called on their bullshit more often if they didn't whack every sentence with a thesaurus."
"61",17,"Xenomoly",2,1,10,8,0,"Shadowbanning. "
"62",18,"Scrappy_The_Crow",2,1,17,2,0,"Ah, I see."
"63",19,"LouthQuill",2,1,10,3,0,"If you want to know more look up 'unbiasing', 'inclusive machine learning', and 'machine learning fairness'. You should get a bunch of results from google about how to properly apply doublethink in software development. Those are the magic words I always want people like Rogan, congressmen, etc to use when talking to these tech leaders. "
"64",20,"Scrappy_The_Crow",2,1,19,2,0,"&gt; how to properly apply doublethink in software development

That phrase doesn't give me a good feeling."
"65",21,"LouthQuill",2,1,20,1,0,"Oldthinkers unbellyfeel blackwhite. Crimestop and speedful learn plusgood duckspeak.  "
